[
  {
    "question": "Nợ phải trả của công ty là bao nhiêu ?",
    "answer": "Dựa vào \"BẢNG CÂN ĐỐI KẾ TOÁN HỢP NHẤT GIỮA NIÊN ĐỘ\" (trên Trang 2), Nợ phải trả của công ty là:\n\n*   **Nợ phải trả (Mã 300) tại Số cuối kỳ (30/06/2025): 212,062,488,987**",
    "contexts": [
      "\n\n\nCÔNG TY CỔ PHẦN THỦY SẢN VIỆT ÚC\n\nMẫu số B 01a – DN/HN\n\nBẢNG CÂN ĐỐI KẾ TOÁN HỢP NHẤT GIỮA NIÊN ĐỘ\n(tiếp theo)\n\n| C. NỢ PHẢI TRẢ                                 | 300  |    | 212,062,488,987   | 139,082,299,444   |\n| ---------------------------------------------- | ---- | -- | ----------------- | ----------------- |\n| I. Nợ ngắn hạn                                 | 310  |    | 205,364,526,410   | 133,606,405,286   |\n| 1. Phải trả người bán ngắn hạn                 | 311  | 11 | 63,012,622,806    | 59,321,522,898    |\n| 2. Người mua trả tiền trước ngắn hạn           | 312  | 12 | 6,305,240,979     | 6,201,365,237     |\n| 3. Thuế và các khoản phải nộp nhà nước         | 313  |    | 6,172,007,054     | 5,179,923,053     |\n| 4. Phải trả người lao động                     | 314  | 13 | 7,317,920,442     | 20,315,623,172    |\n| 5. Chi phí phải trả ngắn hạn                   | 315  | 14 | 20,729,325,308    | 16,726,604,239    |\n| 9. Phải trả ngắn hạn khác                      | 319  |    | 9,262,866,646     | 6,671,617,222     |\n| 10. Vay và nợ thuê tài chính ngắn hạn          | 320  | 15 | 92,564,543,175    | 19,189,749,465    |\n| II. Nợ dài hạn                                 | 330  |    | 6,697,962,577     | 5,475,894,158     |\n| 12. Dự phòng phải trả dài hạn                  | 342  | 16 | 6,697,962,577     | 5,475,894,158     |\n| 13. Quỹ phát triển khoa học và công nghệ       | 343  |    | -                 |                   |\n| D. VỐN CHỦ SỞ HỮU                              | 400  |    | 2,059,828,477,822 | 2,101,532,433,456 |\n| I. Vốn chủ sở hữu                              | 410  | 18 | 2,059,828,477,822 | 2,101,532,433,456 |\n| 1. Vốn góp của chủ sở hữu                      | 411  | 18 | 1,344,838,690,000 | 1,344,838,690,000 |\n| - Cổ phiếu phổ thông có quyền biểu quyết       | 411a |    | 1,344,838,690,000 | 1,344,838,690,000 |\n| 2. Thặng dư vốn cổ phần                        | 412  |    | 526,717,611       | 526,717,611       |\n| 5. Cổ phiếu quỹ                                | 415  |    | -                 | -                 |\n| 11. Lợi nhuận sau thuế chưa phân phối          | 421  |    | 709,225,704,070   | 750,989,432,402   |\n| - LNST chưa phân phối lũy kế đến cuối kỳ trước | 421a |    | 750,989,432,402   | 718,698,284,249   |\n| - LNST chưa phân phối kỳ này                   | 421b |    | (41,763,728,332)  | 32,291,148,153    |\n| 12. Nguồn vốn đầu tư XDCB                      | 422  |    | -                 | -                 |\n| 13. Lợi ích cổ đông không kiểm soát            | 429  |    | 5,237,366,141     | 5,177,593,443     |\n| TỔNG CỘNG NGUỒN VỐN                            | 440  |    | 2,271,890,966,809 | 2,240,614,732,900 |\n\n\nCÔNG TY CỔ PHẦN THỦY SẢN VIỆT ÚC\n\nMẫu số B 02a – DN/HN\n\nBÁO CÁO KẾT QUẢ HOẠT ĐỘNG KINH DOANH HỢP NHẤT GIỮA NIÊN ĐỘ\n\n| Chỉ tiêu                                                              | Mã chỉ tiêu/code | Thuyết minh/notes | Năm nay/This year | Năm trước/Last year |\n| --------------------------------------------------------------------- | ---------------- | ----------------- | ----------------- | ------------------- |\n| 1. Doanh thu bán hàng và cung cấp dịch vụ                             | 01               | 20                | 607,704,438,634   | 647,297,975,710     |\n| 2. Các khoản giảm trừ doanh thu                                       | 02               | 20                | 61,419,636,120    | 56,520,802,554      |\n| 3. Doanh thu thuần về bán hàng và cung cấp dịch vụ (10 = 01-02)       | 10               | 20                | 546,284,802,514   | 590,777,173,156     |\n| 4. Giá vốn hàng bán                                                   | 11               | 21                | 295,945,580,005   | 272,593,803,019     |\n| 5. Lợi nhuận gộp về bán hàng và cung cấp dịch vụ(20=10-11)            | 20               |                   | 250,339,222,509   | 318,183,370,137     |\n| 6. Doanh thu hoạt động tài chính                                      | 21               | 22                | 3,891,263,634     | 6,642,497,971       |\n| 7. Chi phí tài chính                                                  | 22               |                   | 2,237,796,280     | 537,479,437         |\n| - Trong đó: Chi phí lãi vay                                           | 23               |                   | 1,550,715,654     | -                   |\n| 8. Phần lãi trong công ty liên doanh, liên kết                        | 24               |                   | (9,883,164,240)   | (8,378,279,193)     |\n| 9. Chi phí bán hàng                                                   | 25               | 23                | 147,797,741,797   | 156,813,641,022     |\n| 10. Chi phí quản lý doanh nghiệp                                      | 26               | 24                | 121,365,435,554   | 133,944,088,472     |\n| 11. Lợi nhuận thuần từ hoạt động kinh doanh(30=20+(21-22)+24-(25+26)) | 30               |                   | (27,053,651,728)  | 25,152,379,984      |\n| 12. Thu nhập khác                                                     | 31               |                   | 1,511,411,665     | 806,814,056         |\n| 13. Chi phí khác                                                      | 32               |                   | 7,836,707,267     | 427,102,074         |\n| 14. Lợi nhuận khác(40=31-32)                                          | 40               |                   | (6,325,295,602)   | 379,711,982         |\n| 15. Tổng lợi nhuận kế toán trước thuế(50=30+40)                       | 50               |                   | (33,378,947,330)  | 25,532,091,966      |\n| 16. Chi phí thuế TNDN hiện hành                                       | 51               | 26                | 7,829,902,906     | 12,160,978,063      |\n| 17. Chi phí thuế TNDN hoãn lại                                        | 52               |                   | -                 |                     |\n| 18. Lợi nhuận sau thuế thu nhập doanh nghiệp(60=50-51-52)             | 60               |                   | (41,208,850,236)  | 13,371,113,903      |\n| 19. Lợi nhuận sau thuế công ty mẹ                                     | 61               |                   | (41,763,728,332)  | 12,568,033,288      |\n| 20. Lợi nhuận sau thuế công ty mẹ không kiểm soát                     | 62               |                   | 554,878,096       | 803,080,615         |\n| 21. Lãi cơ bản trên cổ phiếu                                          | 70               | 19                | (311)             | 93                  |\n| 22. Lãi suy giảm trên cổ phiếu                                        | 71               | 19                | (311)             | 93                  |\n\n\n\n",
      "\n\n\nVào ngày 04 tháng 04 năm 2025, Công ty đã thành lập Chi Nhánh Công Ty Cổ phần Thủy sản Việt Úc – Nghiên Cứu Và Phát Triển Di Truyền – Hệ Gen (\"Chi nhánh\") tại số 14 Nguyễn Quý Cảnh, Phường An Phú, TP Thủ Đức, Thành phố Hồ Chí Minh theo Giấy chứng nhận đăng ký hoạt động Chi nhánh số 3400322504-009. Chi nhánh được sử dụng làm phòng xét nghiệm và không thực hiện các hoạt động sản xuất, chế biến, trưng bày và phân phối bán lẻ.\n\nVào ngày 04 tháng 04 năm 2025, Công ty đã thành Công Ty Cổ phần Nhà Máy Thủy sản Việt Úc tại ấp Giồng Nhãn, phường Hiệp Thành, tỉnh Cà Mau theo Giấy chứng nhận đăng ký hoạt động số 1900698808. Ngành nghề kinh doanh là chế biến thủy sản.\n\nCổ đông của Công ty và chi tiết về vốn góp được trình bày ở Thuyết minh 17(b).\n\nLĩnh vực kinh doanh của Công ty và các công ty con (gọi chung là \"Tập đoàn\") là thủy sản.\n\nHoạt động chính của Tập đoàn là nuôi trồng thủy sản, sản xuất và kinh doanh giống thủy sản, chế biến thủy sản, sản xuất thức ăn thủy sản và dịch vụ gia công.\n\nChu kỳ sản xuất kinh doanh thông thường của Tập đoàn là trong vòng 12 tháng.\n\nTại ngày 30 tháng 06 năm 2025, Tập đoàn có 1.558 nhân viên (tại ngày 31 tháng 12 năm 2024: 1.850 nhân viên).\n\nTại ngày 30 tháng 06 năm 2025, Tập đoàn có 15 công ty con trực tiếp, 1 công ty con gián tiếp và 1 công ty liên kết (tại ngày 31 tháng 12 năm 2024, Tập đoàn có 14 công ty con trực tiếp, 1 công ty con gián tiếp và 1 công ty liên kết) được trình bày như sau:",
      "\n\n\nCÔNG TY CỔ PHẦN THỦY SẢN VIỆT ÚC\n\nMẫu số B 03a – DN/HN\n\nBÁO CÁO LƯU CHUYỂN TIỀN TỆ HỢP NHẤT GIỮA NIÊN ĐỘ\n(Theo phương pháp gián tiếp)\n\n| Chỉ tiêu                                                                                         | Mã chỉ tiêu/code | Thuyết minh/notes | Năm nay/This year | Năm trước/Last year |\n| ------------------------------------------------------------------------------------------------ | ---------------- | ----------------- | ----------------- | ------------------- |\n| I. Lưu chuyển tiền từ hoạt động kinh doanh                                                       |                  |                   |                   |                     |\n| 1. Lợi nhuận trước thuế                                                                          | 01               |                   | (33,378,947,330)  | 25,532,091,966      |\n| 2. Điều chỉnh cho các khoản                                                                      |                  |                   |                   |                     |\n| - Khấu hao TSCĐ và BĐSĐT                                                                         | 02               |                   | 86,975,532,311    | 77,814,896,278      |\n| - Các khoản dự phòng                                                                             | 03               |                   | (4,074,948,087)   | 7,036,704,866       |\n| - Lãi, lỗ từ hoạt động đầu tư                                                                    | 05               |                   | 9,832,377,957     | 2,693,031,443       |\n| 3. Lợi nhuận từ hoạt động kinh doanh trước thay đổi vốn lưu động                                 | 08               |                   | 59,354,014,851    | 113,076,724,553     |\n| - Tăng, giảm các khoản phải thu                                                                  | 09               |                   | 21,204,913,335    | 11,342,692,005      |\n| - Tăng, giảm hàng tồn kho                                                                        | 10               |                   | (28,406,200,278)  | (65,486,357,717)    |\n| - Tăng, giảm các khoản phải trả (Không kể lãi vay phải trả, thuế thu nhập doanh nghiệp phải nộp) | 11               |                   | (2,770,670,369)   | 17,830,397,189      |\n| - Tăng, giảm chi phí trả trước                                                                   | 12               |                   | 1,060,720,784     | 4,578,548,445       |\n| - Thuế thu nhập doanh nghiệp đã nộp                                                              | 15               |                   | (6,675,905,123)   | (6,150,669,535)     |\n| Lưu chuyển tiền thuần từ hoạt động kinh doanh                                                    | 20               |                   | 43,766,873,200    | 75,191,334,940      |\n| II. Lưu chuyển tiền từ hoạt động đầu tư                                                          |                  |                   |                   |                     |\n| 1.Tiền chi để mua sắm, xây dựng TSCĐ và các tài sản dài hạn khác                                 | 21               |                   | (78,529,643,590)  | (64,035,749,599)    |\n| 2.Tiền thu từ thanh lý, nhượng bán TSCĐ và các tài sản dài hạn khác                              | 22               |                   | -                 | 661,476,529         |\n| 3.Tiền chi cho vay, mua các công cụ nợ của đơn vị khác                                           | 23               |                   | -                 | (9,006,868,542)     |\n| 4.Tiền thu hồi cho vay, bán lại các công cụ nợ của đơn vị khác                                   | 24               |                   | 9,105,582,283     | 41,575,392,111      |\n| 7.Tiền thu lãi cho vay, cổ tức và lợi nhuận được chia                                            | 27               |                   | 3,891,263,634     | 5,801,057,722       |\n| Lưu chuyển tiền thuần từ hoạt động đầu tư                                                        | 30               |                   | (65,532,797,673)  | (25,004,691,779)    |\n| III. Lưu chuyển tiền từ hoạt động tài chính                                                      |                  |                   |                   |                     |\n| 3.Tiền thu từ đi vay                                                                             | 33               |                   | 73,374,793,710    |                     |\n| 6. Cổ tức, lợi nhuận đã trả cho chủ sở hữu                                                       | 36               |                   | (495,105,398)     | (252,945,327,771)   |\n| 7. Tiền thu từ vốn góp của cổ đông không kiểm soát                                               | 37               |                   |                   |                     |\n| Lưu chuyển tiền thuần từ hoạt động tài chính                                                     | 40               |                   | 72,879,688,312    | (252,945,327,771)   |\n| Lưu chuyển tiền thuần trong kỳ (50 = 20+30+40)                                                   | 50               |                   | 51,113,763,839    | (202,758,684,610)   |\n| Tiền và tương đương tiền đầu kỳ                                                                  | 60               |                   | 175,847,443,901   | 298,983,201,792     |\n| Ảnh hưởng của thay đổi tỷ giá hối đoái quy đổi ngoại tệ                                          | 61               |                   |                   |                     |\n| Tiền và tương đương tiền cuối kỳ (70 = 50+60+61)                                                 | 70               | 3                 | 226,961,207,740   | 96,224,517,182      |\n\n\nCÔNG TY CỔ PHẦN THỦY SẢN VIỆT ÚC\n\nMẫu số B 09a – DN/HN\n\nTHUYẾT MINH BÁO CÁO TÀI CHÍNH HỢP NHẤT GIỮA NIÊN ĐỘ\nCHO KỲ KẾ TOÁN SÁU THÁNG KẾT THÚC NGÀY 30 THÁNG 06 NĂM 2025\n\n1     ĐẶC ĐIỂM HOẠT ĐỘNG CỦA CÔNG TY\n\n      Công ty Cổ phần Thủy sản Việt Úc (\"Công ty\") là một công ty cổ phần được thành lập tại\n      nước CHXHCN Việt Nam theo Giấy chứng nhận đầu tư số 481033000210 ngày 28 tháng\n      5 năm 2015 do Ủy ban Nhân dân Tỉnh Bình Thuận cấp có thời hạn là 30 năm kể từ ngày\n      của Giấy phép đầu tư đầu tiên số 08/GP-BT ngày 10 tháng 7 năm 2001. Giấy chứng\n      nhận đăng ký doanh nghiệp số 3400322504 do Sở Kế hoạch và Đầu tư Tỉnh Bình Thuận\n      cấp lần đầu ngày 10 tháng 7 năm 2001 và Giấy chứng nhận đăng ký doanh nghiệp thay\n      đổi gần nhất lần thứ 17 ngày 8 tháng 9 năm 2022 do thay đổi vốn điều lệ.\n\n      Vào ngày 10 tháng 3 năm 2015, Công ty đã thành lập Công ty Cổ phần Thủy sản Việt Úc\n      - Chi nhánh Thành phố Hồ Chí Minh (\"Chi nhánh\") tại số 22-22 Bis, Đường Lê Thánh\n      Tôn, Phường Bến Nghé, Quận 1, Thành phố Hồ Chí Minh theo Giấy chứng nhận đăng\n      ký hoạt động Chi nhánh số 4113000041. Chi nhánh được sử dụng làm văn phòng làm\n      việc và không thực hiện các hoạt động sản xuất, chế biến, trưng bày và phân phối bán\n      lẻ.\n",
      "\n\n# CÔNG TY CỔ PHẦN THỦY SẢN VIỆT ÚC\n\nMẫu số B 01a - DN/HN\n\n## BẢNG CÂN ĐỐI KẾ TOÁN HỢP NHẤT GIỮA NIÊN ĐỘ\n\n| Chỉ tiêu                                            | Mã chỉ tiêu/Code | Thuyết minh/Notes | Số cuối kỳ/Closing | Số đầu năm/Opening |\n| --------------------------------------------------- | ---------------- | ----------------- | ------------------ | ------------------ |\n| **A- TÀI SẢN NGẮN HẠN**                             | 100              |                   | 518,596,414,798    | 462,650,474,362    |\n| I. Tiền và các khoản tương đương tiền               | 110              | 3                 | 226,961,207,740    | 175,847,443,901    |\n| 1. Tiền                                             | 111              |                   | 119,090,440,442    | 75,090,662,549     |\n| 2. Các khoản tương đương tiền                       | 112              |                   | 107,870,767,298    | 100,756,781,352    |\n| II. Các khoản đầu tư tài chính ngắn hạn             | 120              |                   | 48,594,414,982     | 57,699,997,265     |\n| 1. Chứng khoán kinh doanh                           | 121              |                   | -                  | -                  |\n| 2. Dự phòng giảm giá chứng khoán kinh doanh         | 122              |                   |                    |                    |\n| 3. Đầu tư nắm giữ đến ngày đáo hạn                  | 123              | 4                 | 48,594,414,982     | 57,699,997,265     |\n| III. Các khoản phải thu ngắn hạn                    | 130              |                   | 13,502,946,199     | 34,850,816,188     |\n| 1. Phải thu ngắn hạn của khách hàng                 | 131              | 5                 | 7,071,996,688      | 11,637,154,954     |\n| 2. Trả trước cho người bán ngắn hạn                 | 132              | 6                 | 1,542,891,234      | 18,519,553,272     |\n| 3. Phải thu nội bộ ngắn hạn                         | 133              |                   | -                  | -                  |\n| 4. Phải thu theo tiến độ kế hoạch hợp đồng xây dựng | 134              |                   | -                  | -                  |\n| 5. Phải thu về cho vay ngắn hạn                     | 135              |                   | -                  | -                  |\n| 6. Phải thu ngắn hạn khác                           | 136              | 7                 | 4,916,780,656      | 4,722,830,341      |\n| 7. Dự phòng phải thu ngắn hạn khó đòi               | 137              |                   | (28,722,379)       | (28,722,379)       |\n| 8. Tài sản Thiếu chờ xử lý                          | 139              |                   | -                  |                    |\n| IV. Hàng tồn kho                                    | 140              | 8                 | 200,090,746,295    | 166,387,529,511    |\n| 1. Hàng tồn kho                                     | 141              |                   | 203,284,158,258    | 174,877,957,980    |\n| 2. Dự phòng giảm giá hàng tồn kho                   | 149              |                   | (3,193,411,963)    | (8,490,428,469)    |\n| V.Tài sản ngắn hạn khác                             | 150              |                   | 29,447,099,582     | 27,864,687,497     |\n| 1. Chi phí trả trước ngắn hạn                       | 151              | 9                 | 8,546,617,242      | 7,691,351,603      |\n| 2. Thuế GTGT được khấu trừ                          | 152              |                   | 18,584,420,115     | 18,993,539,883     |\n| 3. Thuế và các khoản khác phải thu Nhà nước         | 153              |                   | 2,316,062,225      | 1,179,796,011      |\n| **B. TÀI SẢN DÀI HẠN**                              | 200              |                   | 1,753,294,552,011  | 1,777,964,258,538  |\n| I. Các khoản phải thu dài hạn                       | 210              |                   | 21,807,051,134     | 22,391,240,926     |\n| 6. Phải thu dài hạn khác                            | 216              | 7                 | 21,807,051,134     | 22,391,240,926     |\n| 7. Dự phòng phải thu dài hạn khó đòi                | 219              |                   | -                  |                    |\n| II.Tài sản cố định                                  | 220              | 10                | 1,349,846,383,778  | 1,401,404,400,096  |\n| 1. Tài sản cố định hữu hình                         | 221              |                   | 1,224,455,026,067  | 1,268,013,124,252  |\n| - Nguyên giá                                        | 222              |                   | 2,107,503,602,367  | 2,100,187,388,655  |\n| - Giá trị hao mòn lũy kế                            | 223              |                   | (883,048,576,300)  | (832,174,264,403)  |\n| 3. Tài sản cố định vô hình                          | 227              |                   | 125,391,357,711    | 133,391,275,844    |\n| - Nguyên giá                                        | 228              |                   | 185,362,898,777    | 186,414,191,277    |\n| - Giá trị hao mòn lũy kế                            | 229              |                   | (59,971,541,066)   | (53,022,915,433)   |\n| III. Bất động sản đầu tư                            | 230              |                   | -                  | -                  |\n| - Nguyên giá                                        | 231              |                   | -                  | -                  |\n| - Giá trị hao mòn lũy kế                            | 232              |                   | -                  | -                  |\n| IV. Tài sản dở dang dài hạn                         | 240              |                   | 296,737,650,955    | 257,466,000,709    |\n| 2. Chi phí xây dựng cơ bản dở dang                  | 242              |                   | 296,737,650,955    | 257,466,000,709    |\n| V. Đầu tư tài chính dài hạn                         | 250              |                   | 25,617,008,312     | 35,500,172,552     |\n| 1. Đầu tư vào công ty con                           | 251              |                   | -                  |                    |\n| 2. Đầu tư vào công ty liên kết, liên doanh          | 252              | 4                 | 25,417,008,312     | 35,300,172,552     |\n| 3. Đầu tư góp vốn vào đơn vị khác                   | 253              |                   | -                  | -                  |\n| 4. Dự phòng đầu tư tài chính dài hạn                | 254              |                   | -                  |                    |\n| 5. Đầu tư nắm giữ đến ngày đáo hạn                  | 255              |                   | 200,000,000        | 200,000,000        |\n| VI. Tài sản dài hạn khác                            | 260              |                   | 59,286,457,832     | 61,202,444,255     |\n| 1. Chi phí trả trước dài hạn                        | 261              | 9                 | 59,286,457,832     | 61,202,444,255     |\n| **TỔNG CỘNG TÀI SẢN**                               | 270              |                   | 2,271,890,966,809  | 2,240,614,732,900  |\n\n\n\n",
      "\n\n\nVào ngày 04 tháng 04 năm 2025, Công ty đã thành lập Chi Nhánh Công Ty Cổ phần Thủy sản Việt Úc – Nghiên Cứu Và Phát Triển Di Truyền – Hệ Gen (\"Chi nhánh\") tại số 14 Nguyễn Quý Cảnh, Phường An Phú, TP Thủ Đức, Thành phố Hồ Chí Minh theo Giấy chứng nhận đăng ký hoạt động Chi nhánh số 3400322504-009. Chi nhánh được sử dụng làm phòng xét nghiệm và không thực hiện các hoạt động sản xuất, chế biến, trưng bày và phân phối bán lẻ.\n\nVào ngày 04 tháng 04 năm 2025, Công ty đã thành Công Ty Cổ phần Nhà Máy Thủy sản Việt Úc tại ấp Giồng Nhãn, phường Hiệp Thành, tỉnh Cà Mau theo Giấy chứng nhận đăng ký hoạt động số 1900698808. Ngành nghề kinh doanh là chế biến thủy sản.\n\nCổ đông của Công ty và chi tiết về vốn góp được trình bày ở Thuyết minh 17(b).\n\nLĩnh vực kinh doanh của Công ty và các công ty con (gọi chung là \"Tập đoàn\") là thủy sản.\n\nHoạt động chính của Tập đoàn là nuôi trồng thủy sản, sản xuất và kinh doanh giống thủy sản, chế biến thủy sản, sản xuất thức ăn thủy sản và dịch vụ gia công.\n\nChu kỳ sản xuất kinh doanh thông thường của Tập đoàn là trong vòng 12 tháng.\n\nTại ngày 30 tháng 06 năm 2025, Tập đoàn có 1.558 nhân viên (tại ngày 31 tháng 12 năm 2024: 1.850 nhân viên).\n\nTại ngày 30 tháng 06 năm 2025, Tập đoàn có 15 công ty con trực tiếp, 1 công ty con gián tiếp và 1 công ty liên kết (tại ngày 31 tháng 12 năm 2024, Tập đoàn có 14 công ty con trực tiếp, 1 công ty con gián tiếp và 1 công ty liên kết) được trình bày như sau:"
    ]
  }
 
]